{
  "$schema": "./catalog.schema.json",
  "provider": "anthropic",
  "provenance": {
    "asOf": "2026-07-24",
    "reviewAfter": "2026-08-16",
    "sources": [
      {
        "url": "https://www.anthropic.com/claude/fable",
        "modelFamilies": [
          "claude-fable-5"
        ],
        "scopes": [
          "model-family",
          "availability"
        ]
      },
      {
        "url": "https://www.anthropic.com/news/claude-sonnet-5",
        "modelFamilies": [
          "claude-sonnet-5"
        ],
        "scopes": [
          "model-family",
          "availability",
          "effort-support"
        ]
      },
      {
        "url": "https://platform.claude.com/docs/en/about-claude/models/whats-new-claude-4-8",
        "modelFamilies": [
          "claude-opus-4-8"
        ],
        "scopes": [
          "model-family",
          "availability",
          "effort-support"
        ]
      },
      {
        "url": "https://platform.claude.com/docs/en/build-with-claude/effort",
        "modelFamilies": [
          "claude-opus-5",
          "claude-fable-5",
          "claude-sonnet-5",
          "claude-opus-4-8"
        ],
        "scopes": [
          "effort-support"
        ]
      },
      {
        "url": "https://platform.claude.com/docs/en/about-claude/models/overview",
        "modelFamilies": [
          "claude-opus-5",
          "claude-fable-5",
          "claude-sonnet-5",
          "claude-opus-4-8"
        ],
        "scopes": [
          "availability",
          "model-family",
          "context-window",
          "effective-date"
        ]
      }
    ]
  },
  "transports": [
    "claude-agent-sdk",
    "claude-code"
  ],
  "modelAliases": {
    "sonnet": "claude-sonnet-5",
    "opus": "claude-opus-5",
    "fable": "claude-fable-5"
  },
  "models": {
    "claude-opus-5": {
      "efforts": [
        "low",
        "medium",
        "high",
        "xhigh",
        "max"
      ],
      "routes": {
        "senior": [
          "medium",
          "high"
        ],
        "frontier": [
          "xhigh"
        ]
      },
      "contextWindow": {
        "tokens": 1000000,
        "effectiveFrom": "2026-07-24"
      }
    },
    "claude-sonnet-5": {
      "efforts": [
        "low",
        "medium",
        "high",
        "xhigh",
        "max"
      ],
      "routes": {
        "economy": [
          "low"
        ],
        "standard": [
          "medium"
        ]
      },
      "contextWindow": {
        "tokens": 1000000,
        "effectiveFrom": "2026-07-16"
      }
    },
    "claude-opus-4-8": {
      "efforts": [
        "low",
        "medium",
        "high",
        "xhigh",
        "max"
      ],
      "routes": {
        "senior": [
          "medium",
          "high"
        ],
        "frontier": [
          "xhigh",
          "max"
        ]
      },
      "contextWindow": {
        "tokens": 1000000,
        "effectiveFrom": "2026-07-16"
      }
    },
    "claude-fable-5": {
      "efforts": [
        "low",
        "medium",
        "high",
        "xhigh",
        "max"
      ],
      "routes": {
        "frontier": [
          "xhigh",
          "max"
        ]
      },
      "contextWindow": {
        "tokens": 1000000,
        "effectiveFrom": "2026-07-16"
      }
    }
  },
  "modelDeltas": {
    "claude-opus-5": {
      "kind": "none",
      "reason": "adopted as senior+director default 2026-07-25 on benchmark grounding; exact Opus 5 delta pending a orchestration:elicit calibration pass"
    },
    "claude-sonnet-5": {
      "kind": "none",
      "reason": "the existing unversioned Sonnet self-report does not establish an exact Sonnet 5 calibration"
    },
    "claude-opus-4-8": {
      "kind": "none",
      "reason": "the existing unversioned Opus self-report does not establish an exact Opus 4.8 calibration"
    },
    "claude-fable-5": {
      "kind": "calibrated",
      "path": "docs/deltas/claude-fable-5.md"
    }
  },
  "tiers": {
    "economy": {
      "model": "claude-sonnet-5",
      "efforts": [
        "low"
      ],
      "defaultEffort": "low"
    },
    "standard": {
      "model": "claude-sonnet-5",
      "efforts": [
        "medium"
      ],
      "defaultEffort": "medium"
    },
    "senior": {
      "model": "claude-opus-5",
      "efforts": [
        "medium",
        "high"
      ],
      "defaultEffort": "high"
    },
    "frontier": {
      "model": "claude-opus-5",
      "efforts": [
        "xhigh"
      ],
      "defaultEffort": "xhigh"
    }
  }
}
